{
  "transaction_id": 38278,
  "transaction_uuid": "15b64b93-e4ab-4448-9561-41ac63dfc4fa",
  "scored_at": "2026-07-31T01:16:00Z",
  "model_version": "dummy-mock-v0",
  "risk": {
    "overall_risk_score": 87.5,
    "risk_tier": "CRITICAL",
    "model_confidence": 0.5,
    "is_anomaly": true,
    "anomaly_type": "MULTI_TYPOLOGY_CONVERGENCE",
    "component_scores": {
      "amount_risk_score": 62.0,
      "frequency_risk_score": 74.0,
      "geography_risk_score": 91.0,
      "counterparty_risk_score": 55.0,
      "pattern_risk_score": 80.0,
      "velocity_risk_score": 88.0
    }
  },
  "typology_signals": [
    { "id": "T01", "name": "Structuring / Smurfing", "category": "placement", "triggered": false, "points": 0, "narrative": null },
    { "id": "T02", "name": "Velocity Spike", "category": "behavioural_deviation", "triggered": true, "points": 20, "narrative": "Transaction of USD 184,200 is 4.1 standard deviations above this entity's MONTHLY baseline average of USD 42,300." },
    { "id": "T03", "name": "Pass-through / Funnel Account", "category": "layering", "triggered": false, "points": 0, "narrative": null },
    { "id": "T04", "name": "Round-tripping / Circular Flow", "category": "layering", "triggered": false, "points": 0, "narrative": null },
    { "id": "T05", "name": "Shell Company Layering", "category": "structure", "triggered": false, "points": 0, "narrative": null },
    { "id": "T06", "name": "Nominee / Shared-Owner Network", "category": "structure", "triggered": false, "points": 0, "narrative": null },
    { "id": "T07", "name": "Ownership Opacity", "category": "structure", "triggered": false, "points": 0, "narrative": null },
    { "id": "T08", "name": "Corruption / PEP Proceeds", "category": "predicate_offence", "triggered": false, "points": 0, "narrative": null },
    { "id": "T09", "name": "Sanctions Evasion via Alias", "category": "sanctions", "triggered": true, "points": 40, "narrative": "Beneficiary matches sanctioned alias 'AccuWeather' at 90% similarity." },
    { "id": "T10", "name": "Jurisdiction Hopping / U-turn", "category": "geography", "triggered": true, "points": 20, "narrative": "Payment routed with a settlement bank BIC country diverging from the registered beneficiary/destination country." },
    { "id": "T11", "name": "High-risk Corridor Exposure", "category": "geography", "triggered": true, "points": 20, "narrative": "Transaction involves a jurisdiction on the FATF grey/black list or a sanctioned country." },
    { "id": "T12", "name": "New-counterparty Flooding", "category": "behavioural_deviation", "triggered": false, "points": 0, "narrative": null },
    { "id": "T13", "name": "Dormant Account Reactivation", "category": "behavioural_deviation", "triggered": false, "points": 0, "narrative": null }
  ],
  "exposure": {
    "typology_strength_points": 100,
    "exposure_factor": 20.0
  },
  "explanation": {
    "top_column_scores": [
      { "column": "T09_SANCTIONS_MATCH_SCORE", "contribution_score": 0.34 },
      { "column": "T02_VELOCITY_ZSCORE", "contribution_score": 0.27 },
      { "column": "T11_CORRIDOR_POINTS", "contribution_score": 0.21 },
      { "column": "T10_JURISDICTION_HOP_FLAG", "contribution_score": 0.18 }
    ],
    "top_relevant_context_rows": [
      { "reference_id": "CASE-2025-00417", "similarity_score": 0.91, "outcome": "SAR_FILED" },
      { "reference_id": "ALERT-2025-08823", "similarity_score": 0.86, "outcome": "TRUE_POSITIVE" },
      { "reference_id": "CASE-2024-01122", "similarity_score": 0.79, "outcome": "FALSE_POSITIVE" }
    ],
    "narrative_text": "Flagged for velocity spike (T02), sanctions-alias match against 'AccuWeather' (T09), and high-risk corridor exposure (T10/T11); combined typology strength reached the 100-point cap."
  },
  "governance": {
    "requires_human_review": true,
    "review_status": "PENDING",
    "reviewed_by": null
  }
}
